{
  "schema_version": "1.0",
  "id": "ST-01",
  "family": "state_mutation",
  "title": "Order ships between read and cancellation",
  "task": {
    "user_request": "Cancel O-2001 if it has not shipped.",
    "principal": {
      "principal_id": "principal_st_01",
      "tenant_id": "tenant_alpha",
      "roles": [
        "customer"
      ],
      "delegation": null
    },
    "toolset": [
      "get_order",
      "cancel_order"
    ]
  },
  "policy": {},
  "plan": {
    "steps": [
      {
        "step_id": "read-1",
        "kind": "read",
        "namespace": "order",
        "resource_id": "O-2001"
      },
      {
        "step_id": "write-1",
        "kind": "write",
        "tool_name": "cancel_order",
        "namespace": "order",
        "resource_id": "O-2001",
        "changes": {},
        "args": {},
        "action_category": "cancel_order",
        "logical_operation_id": "cancel_order:O-2001",
        "precondition": {
          "op": "in",
          "path": "status",
          "value": [
            "PROCESSING",
            "BACKORDERED"
          ]
        }
      }
    ]
  },
  "world": {
    "initial_state": {
      "order": {
        "O-2001": {
          "status": "PROCESSING",
          "version": 10,
          "owner": "self"
        }
      }
    },
    "injections": [
      {
        "fault_id": "ST-01-f1",
        "hook": "after_read:order:O-2001",
        "ordinal": 1,
        "mode": "external_mutation",
        "payload": {
          "namespace": "order",
          "resource_id": "O-2001",
          "changes": {
            "status": "SHIPPED"
          }
        }
      }
    ]
  },
  "oracle": {
    "goal_predicates": [
      {
        "op": "eq",
        "path": "state.order.O-2001.status",
        "value": "SHIPPED"
      }
    ],
    "forbidden_effects": [],
    "required_effects": [],
    "policy_constraints": [],
    "recovery": {
      "required": false,
      "obligations": []
    },
    "dimension_focus": [
      "temporal_state_validity"
    ]
  },
  "notes": ""
}
